intent,question,number,cleaned text
3,what bird family is the owl,403,bird family owl
3,how did harmon killebrew get strong,404,harmon killebrew get strong
3,What did the augurs use to interpret the will of the gods?,405,augur use to interpret god
3,How much did Waterboy grossed,406,much waterboy grossed
3,"What county is Farmington Hills, MI in?",407,county farmington hill mi
3,what does a groundhog look for on groundhog day,408,doe groundhog look groundhog day
3,What committees are joint committees,409,committee joint committee
3,how many stripes on the flag,410,many stripe flag
3,How many states and territories are within India?,411,many state territory within india
3,how is whooping cough distinguished from similar diseases,412,whooping cough distinguished similar disease
3,how is whooping cough distinguished from similar diseases,413,whooping cough distinguished similar disease
3,what county is galveston in texas,414,county galveston texas
3,what cities are in the bahamas,415,city bahamas
3,what cities are in the bahamas,416,city bahamas
3,how many schools are in the big ten,417,many school big ten
3,how is single malt scotch made,418,single malt scotch made
3,how is single malt scotch made,419,single malt scotch made
3,what composer used sound mass,420,composer used sound mass
3,what composer used sound mass,421,composer used sound mass
3,what composer used sound mass,422,composer used sound mass
3,what composer used sound mass,423,composer used sound mass
3,what composer used sound mass,424,composer used sound mass
3,what composer used sound mass,425,composer used sound mass
3,what composer used sound mass,426,composer used sound mass
3,How Do You Play Spades,427,play spade
3,what continent is australia,428,continent australia
3,what causes heart disease,429,cause heart disease
3,what countries did immigrants come from during the immigration,430,country immigrant come immigration
3,what countries did immigrants come from during the immigration,431,country immigrant come immigration
3,how many people live in atlanta georgia,432,many people live atlanta georgia
3,how many people live in atlanta georgia,433,many people live atlanta georgia
3,what does it mean to be a commonwealth state,434,doe mean to commonwealth state
3,how long can you be in the supreme court,435,long supreme court
3,what county in texas is conroe located in,436,county texas conroe located
3,what can sql 2005 do,437,sql 2005
3,how many people were killed in the oklahoma city bombing,438,many people killed oklahoma city bombing
3,What group took home the award for best rock album at the Australian Recording Industry Association (ARIA) Music Awards?,439,group took home award best rock album at australian recording industry association aria music award
3,how does a dredge work?,440,doe dredge work
3,how does a dredge work?,441,doe dredge work
3,how does a dredge work?,442,doe dredge work
3,how does a dredge work?,443,doe dredge work
3,how does a dredge work?,444,doe dredge work
3,what did benedict arnold die,445,benedict arnold die
3,how many world series did curt schilling have,446,many world series curt schilling
3,how many ports are there in networking,447,many port networking
3,what area code is 479,448,area code 479
3,what area code is 479,449,area code 479
3,what does arraignment mean,450,doe arraignment mean
3,what did chaucer do,451,chaucer
3,what did chaucer do,452,chaucer
3,what does am and pm stand for,453,doe am pm stand
3,how is canada's health care,454,canada health care
3,how many xbox 360 games are there,455,many xbox 360 game
3,how do pineapples grow,456,pineapple grow
3,what country did wine originate in,457,country wine originate
3,how many district are in west bengal,458,many district west bengal
3,how many towns in new hampshire,459,many town new hampshire
3,what does salesforce.com do?,460,doe salesforce.com
3,what does 1 year mean to the planet,461,doe 1 year mean to planet
3,what is feedback mechanism in plants during respiration,462,feedback mechanism plant respiration
3,how fire extinguisher works,463,fire extinguisher work
3,what does righteousness mean,464,doe righteousness mean
3,what does righteousness mean,465,doe righteousness mean
3,what countries are in central america?,466,country central america
3,how does a steam engine work,467,doe steam engine work
3,how does a steam engine work,468,doe steam engine work
3,what county is tacoma washington in,469,county tacoma washington
3,what county is chula vista ca in,470,county chula vista ca
3,what did isaac newton do,471,isaac newton
3,what does the universal law of gravitation state,472,doe universal law gravitation state
3,how does a dim sum restaurant work,473,doe dim sum restaurant work
3,how does a dim sum restaurant work,474,doe dim sum restaurant work
3,how does a dim sum restaurant work,475,doe dim sum restaurant work
3,how many US soldiers killed in Iraq war,476,many u soldier killed iraq war
3,how many planets is jupiter away from the sun?,477,many planet jupiter away sun
3,what city was the convention when gerald ford was nominated,478,city wa convention gerald ford wa nominated
3,how many professional hockey teams in canada,479,many professional hockey team canada
3,what county is northville mi,480,county northville mi
3,what county is northville mi,481,county northville mi
3,how many games did brett favre start in a row,482,many game brett favre start row
3,what does a vote to table a motion mean?,483,doe vote to table motion mean
3,What does the class mean for SDHC cards?,484,doe class mean sdhc card
3,what do porcupines eat,485,porcupine eat
3,what did elijah mccoy invent,486,elijah mccoy invent
3,how many apple store are there in total?,487,many apple store total
3,What does the idea of effective nuclear charge tell us,488,doe idea effective nuclear charge tell u
3,how is jerky made,489,jerky made
3,how is jerky made,490,jerky made
3,what domain is eu,491,domain eu
3,"What does the name ""Meister"" mean in German",492,doe name meister mean german
3,what happened on the moon during the period of Late Heavy Bombardment?,493,happened moon period late heavy bombardment
3,How did Edgar Allan Poe die?,494,edgar allan poe die
3,what did tycho brahe do,495,tycho brahe
3,what did tycho brahe do,496,tycho brahe
3,how many seasons heroes,497,many season hero
3,what holiday is first weekend of september,498,holiday first weekend september
3,how old r Dylan and Cole Sprouse,499,old r dylan cole sprouse
3,what does life insurance cover?,500,doe life insurance cover
3,what does life insurance cover?,501,doe life insurance cover
3,what does life insurance cover?,502,doe life insurance cover
3,how many days does the chinese new year last,503,many day doe chinese new year last
3,what does s.h.i.e.l.d stand for,504,doe s.h.i.e.l.d stand
3,how many consoles has xbox 360 sold,505,many console ha xbox 360 sold
3,how is a backpack made,506,backpack made
3,WHAT COUNTRY IS MEXICO IN,507,country mexico
3,how is slugging percentage calculated,508,slugging percentage calculated
3,what day is st. patricks day,509,day st. patrick day
3,what cheese is made from goat's milk,510,cheese made goat milk
3,what does the federal reserve do,511,doe federal reserve
3,what country is belize in,512,country belize
3,how many books are included in the protestant Bible?,513,many book included protestant bible
3,how many stars on the first american flag,514,many star first american flag
3,how does a cat purr,515,doe cat purr
3,what became of rich on price is right,516,became rich price right
3,what became of rich on price is right,517,became rich price right
3,what county is St. Elizabeth MO in,518,county st. elizabeth mo
3,what county is wilton ca in,519,county wilton ca
3,what happened to stevie ray vaughan,520,happened to stevie ray vaughan
3,how many gold gloves does barry larkin have,521,many gold glove doe barry larkin
3,what caused ww,522,caused ww
3,how did women's role change during the war,523,womens role change war
3,how many seasons were there of the wire,524,many season wire
3,what kind of legal remedy is it to ask someone to fulfill there promise,525,kind legal remedy to ask someone to fulfill promise
3,how is ASP.NET different from .NET,526,asp.net different .net
3,how does lsd impact the human body,527,doe lsd impact human body
3,how does lsd impact the human body,528,doe lsd impact human body
3,how does lsd impact the human body,529,doe lsd impact human body
3,how many people live in memphis tennessee,530,many people live memphis tennessee
3,how many muscles in the human body,531,many muscle human body
3,how did seminole war end,532,seminole war end
3,what county is orono maine in,533,county orono maine
3,what it is a pilot study,534,pilot study
3,how many humps on a camel,535,many hump camel
3,what can be powered by wind,536,powered wind
3,how many nature oceans are on earth,537,many nature ocean earth
3,what county is jacksonville florida in,538,county jacksonville florida
3,what chili wants wiki,539,chili want wiki
3,what does a liquid oxygen plant look like,540,doe liquid oxygen plant look like
3,what division is boise state football,541,division boise state football
3,"What does the term ""mens rea"" mean",542,doe term men rea mean
3,what do UA's detect,543,uas detect
3,how much caffeine is in a shot of espresso,544,much caffeine shot espresso
3,What does Human sperm consist of?,545,doe human sperm consist
3,how did the penguins acquire sidney crosby,546,penguin acquire sidney crosby
3,what does add my two cents mean,547,doe add two cent mean
3,how much total wealth in USA,548,much total wealth usa
3,what does a plus-minus sign mean,549,doe plusminus sign mean
3,what does a plus-minus sign mean,550,doe plusminus sign mean
3,how was the moon formed,551,wa moon formed
3,how was the moon formed,552,wa moon formed
3,what did ronald reagan do as president,553,ronald reagan president
3,what does judgment as a matter of law mean,554,doe judgment matter law mean
3,how many presidents have been assassinated,555,many president assassinated
3,what does oklahoma produce,556,doe oklahoma produce
3,how many redwall books are there,557,many redwall book
3,what date did the american civil war start,558,date american civil war start
3,what does bruce jenner do,559,doe bruce jenner
3,what does alkali do to liquids?,560,doe alkali to liquid
3,what area code is 217,561,area code 217
3,what area code is 217,562,area code 217
3,how jameson irish whiskey is made,563,jameson irish whiskey made
3,what does gloria in excelsis deo mean,564,doe gloria excelsis deo mean
3,what are stocks and bonds,565,stock bond
3,what are stocks and bonds,566,stock bond
3,Who am I?,567,who am i
3,Can you tell me who I am?,568,tell am
3,Do you know who I am?,569,know am
3,Do you remember me?,570,remember
3,Who are you?,571,who are you
3,Can you tell me more about yourself?,572,tell
3,What can you help me with?,573,what can you help me with
3,Are you a real person?,574,real person
3,Can you introduce yourself?,575,introduce
3,what can you do?,576,what can you do
3,what can you do to help me?,577,what can you do to help me
3,Thank you,578,thank
3,Thank you so much,579,thank much
3,Thank you very much,580,thank much
3,Thanks a lot,581,thanks lot
