intent,question,number,cleaned text
0,Hello!,0,hello
0,Nice to meet you!,1,nice to meet
0,Good morning! What's on your mind?,2,good morning whats mind
0,How are you doing?,3,how are you doing
0,How are you,4,how are you
0,Hey!,5,hey
0,Greetings! How can I assist you today?,6,greeting assist today
0,Hi! What's up?,7,hi whats up
0,How can I be of service?,8,service
0,Hope you're having a good day!,9,hope youre good day
0,Hey there! How can I support you today?,10,hey support today
0,Hi there! How's your day going?,11,hi hows day going
0,Good to see you! What brings you here today?,12,good to see brings today
0,How's everything with you?,13,hows everything
0,Hope you're doing well.,14,hope youre well .
0,Hey! Long time no see!,15,hey long time no see
0,What can I help you with today?,16,help today
0,Good afternoon! How can I assist?,17,good afternoon assist
0,Hello! Anything I can do for you?,18,hello anything
0,What's happening?,19,whats happening
0,Greetings! What's new?,20,greeting whats new
0,How have you been?,21,
0,Hello! What's your day like?,22,hello whats day like
0,Good evening! How can I be of service?,23,good evening service
0,Hey! What's going on?,24,hey whats going
0,Anything interesting happening?,25,anything interesting happening
0,How can I help you today?,26,help today
0,Greetings! What's on your mind?,27,greeting whats mind
0,How's it going?,28,hows going
0,Hope you're having a good time.,29,hope youre good time .
0,Hey! How's your week so far?,30,hey hows week far
0,What would you like to talk about?,31,would like to talk
0,Anything exciting to share?,32,anything exciting to share
0,How are things with you?,33,thing
0,Good day! How can I assist you?,34,good day assist
0,Hey! What's new and exciting?,35,hey whats new exciting
0,How's your morning/afternoon/evening?,36,hows morningafternoonevening
0,Greetings! What can I do for you today?,37,greeting what can i do for you today
0,Hey! What's happening in your world?,38,hey whats happening world
0,How's your weekend going?,39,hows weekend going
0,Good morning! Ready to chat?,40,good morning ready to chat
0,What's your plan for today?,41,whats plan today
0,Hi there! What's the latest?,42,hi whats latest
0,Hey! Do you have a minute to chat?,43,hey minute to chat
0,How can I brighten your day?,44,brighten day
0,Anything on your mind?,45,anything mind
0,Greetings! Hope you're doing well.,46,greeting hope youre well .
0,Hi! Long time no talk!,47,hi long time no talk
0,Hey! What brings you here?,48,hey brings
0,Hello! How are you?,49,hello how are you
0,Hi! How's it going?,50,hi hows going
0,Good morning! How are you today?,51,good morning how are you today
0,Hey! What's up?,52,hey whats up
0,Hi there! What's new?,53,hi whats new
0,Hello! Hope you're well.,54,hello hope youre well .
0,Hey! How have you been?,55,hey
0,Hi! How's your day?,56,hi hows day
0,Hello! How's everything going?,57,hello hows everything going
0,Good evening! How are you doing?,58,good evening how are you doing
0,Hi! What's going on?,59,hi whats going
0,Hey! How's life?,60,hey hows life
0,Hello! How's it been?,61,hello hows
0,How are things?,62,thing
0,Good day! How are you feeling?,63,good day how are you feeling
0,Hey! How's today treating you?,64,hey hows today treating
0,How have you been lately?,65,lately
0,What's on your mind today?,66,whats mind today
0,Hey! How do you do?,67,hey
0,Nice to meet you!,68,nice to meet
0,Nice to meet you!,69,nice to meet
0,Nice to meet you!,70,nice to meet
0,Nice to meet you!,71,nice to meet
0,Nice to meet you!,72,nice to meet
0,Nice to meet you!,73,nice to meet
0,Nice to meet you!,74,nice to meet
0,Nice to meet you!,75,nice to meet
0,Nice to meet you!,76,nice to meet
0,Nice to meet you!,77,nice to meet
0,How are you,78,how are you
0,How are you,79,how are you
0,How are you,80,how are you
0,How are you,81,how are you
0,How are you,82,how are you
1,How do I reset my password?,83,reset password
1,Can I change my account email address?,84,change account email address
1,What steps do I take to recover my username?,85,step take to recover username
1,How can I update my security questions?,86,update security question
1,How do I enable two-factor authentication?,87,enable twofactor authentication
1,Can I link my account with social media?,88,link account social medium
1,How do I update my profile information?,89,update profile information
1,What should I do if my account is locked?,90,account locked
1,How can I delete my account permanently?,91,delete account permanently
1,Is it possible to change my username?,92,possible to change username
1,How do I change my password?,93,change password
1,What should I do if I forget my security question answers?,94,forget security question answer
1,Can I update my phone number linked to the account?,95,update phone number linked to account
1,How do I enable login alerts?,96,enable login alert
1,How do I recover a deleted account?,97,recover deleted account
1,Is it possible to disable two-factor authentication?,98,possible to disable twofactor authentication
1,How can I verify my email address?,99,verify email address
1,Where can I check my recent login activity?,100,check recent login activity
1,How do I secure my account from unauthorized access?,101,secure account unauthorized access
1,Can I add a backup email for recovery?,102,add backup email recovery
1,What options do I have for account recovery?,103,option account recovery
1,How do I restrict access to my profile?,104,restrict access to profile
1,Can I temporarily deactivate my account?,105,temporarily deactivate account
1,What steps should I take to change my security settings?,106,step take to change security setting
1,Is there a way to unlink my account from third-party services?,107,way to unlink account thirdparty service
1,How can I add an alternative phone number for verification?,108,add alternative phone number verification
1,Can I remove saved login details from my account?,109,remove saved login detail account
1,How do I check if my account has been compromised?,110,check account ha compromised
1,How do I change my profile picture?,111,change profile picture
1,Is there a way to lock my account manually?,112,way to lock account manually
1,How can I deactivate account recovery options?,113,deactivate account recovery option
1,Can I customize my account's privacy settings?,114,customize account privacy setting
1,How do I set up a new security PIN?,115,set new security pin
1,What should I do if I suspect my account was hacked?,116,suspect account wa hacked
1,How do I manage connected devices?,117,manage connected device
1,Can I receive alerts for login attempts from unknown locations?,118,receive alert login attempt unknown location
1,Where can I manage linked accounts?,119,manage linked account
1,How do I add a recovery question to my account?,120,add recovery question to account
1,Is it possible to view my account's access history?,121,possible to view account access history
1,How can I prevent unauthorized logins?,122,prevent unauthorized logins
1,How do I enable automatic account lockout?,123,enable automatic account lockout
1,Can I set specific login hours for my account?,124,set specific login hour account
1,How can I verify my phone number?,125,verify phone number
1,Where can I see the devices logged into my account?,126,see device logged account
1,How do I enable or disable login notifications?,127,enable disable login notification
1,Can I limit access to specific devices?,128,limit access to specific device
1,How do I set up a security phrase for verification?,129,set security phrase verification
1,Can I restrict access based on geographic location?,130,restrict access based geographic location
1,How can I delete my backup recovery methods?,131,delete backup recovery method
1,Is there a way to check login attempts?,132,way to check login attempt
1,How do I verify my account through a phone call?,133,verify account phone call
1,Can I change my recovery email?,134,change recovery email
1,How do I restrict logins to specific IP addresses?,135,restrict logins to specific ip address
1,What happens if I enter the wrong password too many times?,136,happens enter wrong password many time
1,How can I make my profile private?,137,make profile private
1,How do I create a strong password?,138,create strong password
1,Is there a way to enable biometric login?,139,way to enable biometric login
1,How can I link another email to my account?,140,link another email to account
1,Can I receive notifications for changes made to my account?,141,receive notification change made to account
1,How do I review past login sessions?,142,review past login session
1,Is it possible to delete my profile information?,143,possible to delete profile information
1,How can I change my email?,144,change email
1,How do I update my phone number?,145,update phone number
1,Can I reset my password?,146,reset password
1,How do I delete my account?,147,delete account
1,What should I do if I forget my username?,148,forget username
1,How do I link my social media account?,149,link social medium account
1,Can I update my security settings?,150,update security setting
1,How do I check my login history?,151,check login history
1,How can I change my username?,152,change username
1,How do I recover my account?,153,recover account
1,Where can I find my account settings?,154,find account setting
1,How do I enable two-factor authentication?,155,enable twofactor authentication
1,Can I remove a linked device?,156,remove linked device
1,How do I change my profile picture?,157,change profile picture
1,How can I add a recovery email?,158,add recovery email
1,How do I make my profile private?,159,make profile private
1,What should I do if my account is locked?,160,account locked
1,Can I receive alerts for account changes?,161,receive alert account change
1,How do I verify my phone number?,162,verify phone number
1,How can I update my security questions?,163,update security question
2,Can you recommend some popular attractions nearby?,164,recommend popular attraction nearby
2,Where can I find a good restaurant?,165,find good restaurant
2,What are some must-see places in the area?,166,mustsee place area
2,Are there any parks close to me?,167,park close to
2,Where can I go shopping?,168,go shopping
2,Can you suggest a nearby coffee shop?,169,suggest nearby coffee shop
2,What events are happening this weekend?,170,event happening weekend
2,Are there any local museums worth visiting?,171,local museum worth visiting
2,Can you find me a nearby bookstore?,172,find nearby bookstore
2,Where's a good spot for hiking?,173,wheres good spot hiking
2,Are there any concerts happening tonight?,174,concert happening tonight
2,Where can I find fresh produce markets?,175,find fresh produce market
2,Can you recommend a quiet place to relax?,176,recommend quiet place to relax
2,Where are the best places for sightseeing?,177,best place sightseeing
2,Are there any art galleries nearby?,178,art gallery nearby
2,Can you find me a gym or fitness center?,179,find gym fitness center
2,Where can I see live music?,180,see live music
2,What's a popular place to watch the sunset?,181,whats popular place to watch sunset
2,Are there any nearby theaters?,182,nearby theater
2,Can you suggest a good walking trail?,183,suggest good walking trail
2,What are some good places for a weekend trip?,184,good place weekend trip
2,Can you find me a pet-friendly park?,185,find petfriendly park
2,Where's the best spot for photography?,186,wheres best spot photography
2,Are there any local breweries nearby?,187,local brewery nearby
2,Can you recommend a popular tourist area?,188,recommend popular tourist area
2,Where can I go for a picnic?,189,go picnic
2,What's the nearest library?,190,whats nearest library
2,Are there any good wine tasting spots?,191,good wine tasting spot
2,Can you find a nearby yoga class?,192,find nearby yoga class
2,Where are the best scenic views in the city?,193,best scenic view city
2,Is there a flea market happening soon?,194,flea market happening soon
2,Can you find me a good seafood restaurant?,195,find good seafood restaurant
2,Are there any free attractions nearby?,196,free attraction nearby
2,Where can I go kayaking?,197,go kayaking
2,What are the best beaches around?,198,best beach around
2,Can you suggest a place for night walks?,199,suggest place night walk
2,Where is the nearest art supply store?,200,nearest art supply store
2,Are there any guided tours available?,201,guided tour available
2,Where can I find a farmers' market?,202,find farmer market
2,What's the best local cuisine spot?,203,whats best local cuisine spot
2,Can you recommend a bookstore cafe?,204,recommend bookstore cafe
2,Where's a quiet place to read?,205,wheres quiet place to read
2,Are there any historical landmarks to visit?,206,historical landmark to visit
2,Where can I find unique local crafts?,207,find unique local craft
2,Are there any upcoming theater performances?,208,upcoming theater performance
2,Where's a good spot to watch sports games?,209,wheres good spot to watch sport game
2,What are some family-friendly activities?,210,familyfriendly activity
2,Can you suggest a good spa nearby?,211,suggest good spa nearby
2,Are there any cooking classes around?,212,cooking class around
2,Where can I rent bikes?,213,rent bike
2,What are the top-rated bakeries here?,214,toprated bakery
2,Is there a nearby community center?,215,nearby community center
2,Where's the best area for antique shopping?,216,wheres best area antique shopping
2,Can you recommend an outdoor dining spot?,217,recommend outdoor dining spot
2,Where can I try local street food?,218,try local street food
2,Are there any jazz clubs around?,219,jazz club around
2,Can you find me a karaoke bar?,220,find karaoke bar
2,Where can I find organic food stores?,221,find organic food store
2,What are some good hiking trails?,222,good hiking trail
2,Is there a fitness center open 24 hours?,223,fitness center open 24 hour
2,Where's a good spot to take kids?,224,wheres good spot to take kid
2,Can you suggest a good rooftop bar?,225,suggest good rooftop bar
2,Where's a romantic place for dinner?,226,wheres romantic place dinner
2,Are there any nearby hot springs?,227,nearby hot spring
2,Can you recommend a co-working space?,228,recommend coworking space
2,Where can I see the stars clearly?,229,see star clearly
2,What are the best spots for street food?,230,best spot street food
2,Are there any local festivals this month?,231,local festival month
2,Where can I buy artisanal cheese?,232,buy artisanal cheese
2,Can you suggest a scenic driving route?,233,suggest scenic driving route
2,Where can I find a nearby park?,234,find nearby park
2,Are there any good cafes around?,235,good cafe around
2,Can you recommend a place to eat?,236,recommend place to eat
2,Where's the nearest grocery store?,237,wheres nearest grocery store
2,Are there any museums close by?,238,museum close
2,Where can I buy fresh fruits?,239,buy fresh fruit
2,Is there a library nearby?,240,library nearby
2,Can you find a quiet place to relax?,241,find quiet place to relax
2,Where's a good spot for a walk?,242,wheres good spot walk
2,Are there any local events today?,243,local event today
2,Can you suggest a place for dinner?,244,suggest place dinner
2,Where is the nearest hospital?,245,nearest hospital
2,Are there any playgrounds for kids?,246,playground kid
2,Where's a good place for shopping?,247,wheres good place shopping
2,Can you find a bookstore for me?,248,find bookstore
2,Where can I get coffee?,249,get coffee
2,Is there a gym nearby?,250,gym nearby
2,Where can I find a bakery?,251,find bakery
2,Are there any markets around here?,252,market around
2,Where can I go for a swim?,253,go swim
3,What's your favorite color?,254,whats favorite color
3,Do you have any hobbies?,255,hobby
3,What's your favorite movie?,256,whats favorite movie
3,Do you like music?,257,like music
3,What's your dream job?,258,whats dream job
3,Do you have a pet?,259,pet
3,What's your favorite season?,260,whats favorite season
3,Have you ever traveled abroad?,261,ever traveled abroad
3,What's your favorite food?,262,whats favorite food
3,Do you enjoy reading books?,263,enjoy reading book
3,What's your favorite holiday?,264,whats favorite holiday
3,"If you could have any superpower, what would it be?",265,could superpower would
3,Do you like sports?,266,like sport
3,What's your favorite book?,267,whats favorite book
3,What's your favorite animal?,268,whats favorite animal
3,Do you like to cook?,269,like to cook
3,Have you ever tried a new hobby recently?,270,ever tried new hobby recently
3,Do you prefer tea or coffee?,271,prefer tea coffee
3,What's the best place you've visited?,272,whats best place youve visited
3,Do you believe in luck?,273,believe luck
3,Do you have a favorite memory?,274,favorite memory
3,What's the best advice you've ever received?,275,whats best advice youve ever received
3,"If you could visit any country, where would you go?",276,could visit country would go
3,What do you like about people?,277,like people
3,Have you ever tried something completely new?,278,ever tried something completely new
3,What's your favorite time of the day?,279,whats favorite time day
3,Do you enjoy art and creativity?,280,enjoy art creativity
3,Do you have a favorite joke?,281,favorite joke
3,What's your biggest wish?,282,whats biggest wish
3,Are you a morning person or a night owl?,283,morning person night owl
3,What's the coolest invention you've heard of?,284,whats coolest invention youve heard
3,"If you could learn any skill instantly, what would it be?",285,could learn skill instantly would
3,Do you like puzzles or brainteasers?,286,like puzzle brainteasers
3,What's your favorite type of weather?,287,whats favorite type weather
3,Do you enjoy learning new things?,288,enjoy learning new thing
3,What's something that always makes you smile?,289,whats something always make smile
3,"If you had one wish, what would it be?",290,one wish would
3,Do you have a favorite word?,291,favorite word
3,Have you ever been inspired by someone?,292,ever inspired someone
3,Do you enjoy playing games?,293,enjoy playing game
3,"What makes a good friend, in your opinion?",294,make good friend opinion
3,Do you have a favorite quote?,295,favorite quote
3,Are you an optimist or a realist?,296,optimist realist
3,What's the funniest thing you've heard recently?,297,whats funniest thing youve heard recently
3,"If you could change one thing in the world, what would it be?",298,could change one thing world would
3,Do you believe in second chances?,299,believe second chance
3,What's the most interesting thing you've learned?,300,whats interesting thing youve learned
3,Do you enjoy spending time outdoors?,301,enjoy spending time outdoors
3,What's your favorite way to relax?,302,whats favorite way to relax
3,"If you had a time machine, where would you go?",303,time machine would go
3,What's something you want to learn more about?,304,whats something want to learn
3,Are you a fan of surprises?,305,fan surprise
3,What's your favorite childhood memory?,306,whats favorite childhood memory
3,Do you prefer working alone or in a team?,307,prefer working alone team
3,Have you ever accomplished something you're proud of?,308,ever accomplished something youre proud
3,Do you like trying new foods?,309,like trying new food
3,What's your favorite form of entertainment?,310,whats favorite form entertainment
3,Are you good at keeping secrets?,311,good at keeping secret
3,What's one habit you'd like to break?,312,whats one habit youd like to break
3,"If you were an animal, what would you be?",313,animal would
3,Do you like making plans or being spontaneous?,314,like making plan spontaneous
3,What's something you find fascinating?,315,whats something find fascinating
3,Have you ever made a big decision on a whim?,316,ever made big decision whim
3,What motivates you the most?,317,motivates
3,"If you had unlimited free time, how would you use it?",318,unlimited free time would use
3,Do you like talking about dreams and goals?,319,like talking dream goal
3,What's one thing you wish you knew more about?,320,whats one thing wish knew
3,Have you ever been surprised by someone?,321,ever surprised someone
3,Do you have a role model?,322,role model
3,What's one thing that never fails to make you laugh?,323,whats one thing never fails to make laugh
3,Do you enjoy challenges?,324,enjoy challenge
3,Do you believe in destiny?,325,believe destiny
3,What's your idea of a perfect day?,326,whats idea perfect day
3,Are you a fan of technology?,327,fan technology
3,What's one thing you can't live without?,328,whats one thing cant live without
3,Do you like meeting new people?,329,like meeting new people
3,What's your favorite way to start the day?,330,whats favorite way to start day
3,Do you prefer quiet places or bustling ones?,331,prefer quiet place bustling one
3,What's a goal you're working towards?,332,whats goal youre working towards
3,"If you could live anywhere, where would it be?",333,could live anywhere would
3,Do you like listening to people's stories?,334,like listening to people story
3,What's the best gift you've ever received?,335,whats best gift youve ever received
3,Are you more of a thinker or a doer?,336,thinker doer
3,Do you believe in love at first sight?,337,believe love at first sight
3,What's something you wish you could do better?,338,whats something wish could better
3,Do you have a hidden talent?,339,hidden talent
3,What's your favorite way to spend a weekend?,340,whats favorite way to spend weekend
3,Are you a morning person?,341,morning person
3,What's your favorite part about learning something new?,342,whats favorite part learning something new
3,Do you like planning things out?,343,like planning thing
3,What's one thing you'd change about yourself?,344,whats one thing youd change
3,Do you enjoy surprises?,345,enjoy surprise
3,What's the most difficult decision you've made?,346,whats difficult decision youve made
3,Are you someone who likes taking risks?,347,someone like taking risk
3,What's the most memorable place you've been?,348,whats memorable place youve
3,Do you like trying new experiences?,349,like trying new experience
3,Are you good at multitasking?,350,good at multitasking
3,What's your dream vacation destination?,351,whats dream vacation destination
3,Do you believe in karma?,352,believe karma
3,What's your favorite subject to talk about?,353,whats favorite subject to talk
3,What's something that makes you feel accomplished?,354,whats something make feel accomplished
3,HOW AFRICAN AMERICANS WERE IMMIGRATED TO THE US,355,african american immigrated to u
3,how are glacier caves formed?,356,glacier cave formed
3,how a water pump works,357,water pump work
3,"how big is bmc software in houston, tx",358,big bmc software houston tx
3,"how big is bmc software in houston, tx",359,big bmc software houston tx
3,how much is 1 tablespoon of water,360,much 1 tablespoon water
3,how much is 1 tablespoon of water,361,much 1 tablespoon water
3,how much is 1 tablespoon of water,362,much 1 tablespoon water
3,how much are the harry potter movies worth,363,much harry potter movie worth
3,how a rocket engine works,364,rocket engine work
3,how old was sue lyon when she made lolita,365,old wa sue lyon made lolita
3,how are cholera and typhus transmitted and prevented,366,cholera typhus transmitted prevented
3,how did anne frank die,367,anne frank die
3,how are aircraft radial engines built,368,aircraft radial engine built
3,how deep can be drill for deep underwater,369,deep drill deep underwater
3,how old was monica lewinsky during the affair,370,old wa monica lewinsky affair
3,how long was frank sinatra famous,371,long wa frank sinatra famous
3,how are antibodies used in,372,antibody used
3,how are antibodies used in,373,antibody used
3,how are antibodies used in,374,antibody used
3,how are antibodies used in,375,antibody used
3,how much is jk rowling worth,376,much jk rowling worth
3,how big is auburndale florida,377,big auburndale florida
3,"how old is kirk douglas, the actor?",378,old kirk douglas actor
3,how old is the singer bob seger,379,old singer bob seger
3,how long was i love lucy on the air,380,long wa love lucy air
3,how long was richard nixon a president,381,long wa richard nixon president
3,HOW MUCH IS CENTAVOS IN MEXICO,382,much centavo mexico
3,How long was Mickie James with WWE?,383,long wa mickie james wwe
3,how did armando christian perez become famous,384,armando christian perez become famous
3,how old were the twin towers when destroyed,385,old twin tower destroyed
3,how are the # of electrons in each shell determined,386,electron shell determined
3,how many presidents of the us,387,many president u
3,how old is beatrice author,388,old beatrice author
3,how are public schools funded,389,public school funded
3,how are public schools funded,390,public school funded
3,what happens  to the light independent reactions of photosynthesis?,391,happens to light independent reaction photosynthesis
3,what happens  to the light independent reactions of photosynthesis?,392,happens to light independent reaction photosynthesis
3,how does interlibrary loan work,393,doe interlibrary loan work
3,how does interlibrary loan work,394,doe interlibrary loan work
3,what did mia hamm do his work,395,mia hamm work
3,what bacteria grow on macconkey agar,396,bacteria grow macconkey agar
3,what countries are under the buddhism religion,397,country buddhism religion
3,how did wild bill's father die,398,wild bill father die
3,how many land rovers have landed on mars,399,many land rover landed mar
3,how do forensic auditors examine financial reporting,400,forensic auditor examine financial reporting
3,how do forensic auditors examine financial reporting,401,forensic auditor examine financial reporting
3,how do forensic auditors examine financial reporting,402,forensic auditor examine financial reporting
